<?xml version="1.0" encoding="UTF-8"?>
<matches xmlns:xsi="http://www.w3.org/2001/XMLSchema-instance" xsi:noNamespaceSchemaLocation="matches.xsd">
    <match date="2022-02-06">
        <referee name="Enric Molina" />
        <player name="Nadal" />
        <player name="Novak" />
    </match>
    <match date="2018-09-30">
        <referee name="Denis Overberg" />
        <player name="Nadal" />
        <player name="Federer" />
    </match>
    <match date="2015-10-24">
        <referee name="David Littlefield" />
        <player name="Ferrer" />
        <player name="Novak" />
    </match>
    
</matches>